{
  "id": "doc-ingestion-retrieval-v1",
  "version": "1",
  "primaryMetric": "docIngestion.contextRecallAtK",
  "direction": "maximize",
  "parameters": [
    {
      "id": "topK",
      "classification": "quality-tunable",
      "type": "integer",
      "values": [3, 5, 8, 10],
      "rationale": "Controls final retrieved chunk depth for grounded recall rows. Phase 10d-B2 excludes topK=12 from promotion candidates unless a later reviewed answer-quality run approves it."
    },
    {
      "id": "candidateK",
      "classification": "quality-tunable",
      "type": "integer",
      "values": [12, 24],
      "rationale": "Preserves the production baseline at 12 while Phase 10d-B2 measures a larger real candidate pool at 24. Values 32 and 50 require separate budget-approved live exports."
    },
    {
      "id": "rrfK",
      "classification": "quality-tunable",
      "type": "integer",
      "values": [20, 60, 100],
      "rationale": "Controls reciprocal-rank-fusion smoothing over dense and BM25 rank signals."
    }
  ]
}
